{
  "$schema": "https://ai-json.org/schema/v1.json",
  "version": 1,
  "project": {
    "name": "command-names"
  },
  "commands": {
    "abc": "echo abc",
    "ABC": "echo ABC",
    "test_1": "echo test_1",
    "format-check": "echo format-check",
    "format.check": "echo format.check",
    "format:check": "echo format:check"
  },
  "quality": {
    "required": ["abc", "ABC", "test_1", "format-check", "format.check", "format:check"]
  }
}
